<?xml version="1.0" encoding="utf-8"?>
<blockset 	xmlns:xsi="http://www.w3.org/2001/XMLSchema-instance" 
		xsi:noNamespaceSchemaLocation="../../../../../schemas/blockset.xsd" >
	
	<abstractBlocks >
		<block name="common" folder="_common" />
		
		<group name="hardwalls" folder="hardwalls">
			<block name="common_hard" folder="_common"/>
		</group>
	</abstractBlocks>
	
	<concreteBlocks>
		<block folder="softwall" name="softwall" />
		
		<group name="hardwalls" folder="hardwalls">
			<block name="regular" folder="regular"/>
			
			<block name="insidedown" folder="insidedown"/>
			<block name="insidedownleft" folder="insidedownleft"/>
			<block name="insidedownright" folder="insidedownright"/>
			<block name="insideleft" folder="insideleft"/>
			<block name="insideleftdown" folder="insideleftdown"/>
			<block name="insideleftup" folder="insideleftup"/>
			<block name="insideright" folder="insideright"/>
			<block name="insiderightdown" folder="insiderightdown"/>
			<block name="insiderightup" folder="insiderightup"/>
			<block name="insideup" folder="insideup"/>
			<block name="insideupleft" folder="insideupleft"/>
			<block name="insideupright" folder="insideupright"/>
			<block name="outsidedownleft" folder="outsidedownleft"/>
			<block name="outsidedownright" folder="outsidedownright"/>
			<block name="outsideleft" folder="outsideleft"/>
			<block name="outsideleftdown" folder="outsideleftdown"/>
			<block name="outsideright" folder="outsideright"/>
			<block name="outsiderightdown" folder="outsiderightdown"/>
			<block name="outsideupleft" folder="outsideupleft"/>
			<block name="outsideupright" folder="outsideupright"/>
		</group>
	</concreteBlocks>
	
</blockset>
